Gene	Gene.name	Tissue	nTPM	fda	gwcat	gwasTraits	fdaGeneDesc
ENSG00000168792	ABHD15	liver	26.2	0	1	LDL cholesterol levels;Brain morphology (MOSTest);Height;Waist-to-hip ratio adjusted for BMI;Hip circumference adjusted for BMI	
ENSG00000160323	ADAMTS13	liver	63.8	0	1	vWF levels in ischaemic stroke and hyperhomocysteinaemia;Gut microbiota (functional units);Blood protein levels;ADAMTS13 activity	
ENSG00000079557	AFM	liver	961.6	0	1	Urinary metabolite levels in chronic kidney disease;Blood protein levels;Gut microbiota (bacterial taxa, rank normal transformation method);Type 2 diabetes	
ENSG00000135744	AGT	liver	1603.7	0	1	Type 2 diabetes;Systolic blood pressure (cigarette smoking interaction);Diastolic blood pressure (cigarette smoking interaction);Systolic blood pressure;Height	
ENSG00000145192	AHSG	liver	5817.6	0	1	Blood protein levels;Activated partial thromboplastin time	
ENSG00000163631	ALB	liver	212494	1	1	General risk tolerance (MTAG);Risk-taking tendency (4-domain principal component model);Bone mineral content	Albumin
ENSG00000106927	AMBP	liver	10947.9	0	1	Serum metabolite levels;Anti-saccade response;Blood protein levels	
ENSG00000214274	ANG	liver	3018.1	0	1	Blood metabolite levels;Fractional exhaled nitric oxide (childhood);Metabolite levels;Cholesterol, total	
ENSG00000132855	ANGPTL3	liver	675.7	0	1	Blood metabolite levels;Cholesterol, total;LDL cholesterol;Triglycerides;Triglyceride levels	
ENSG00000167772	ANGPTL4	liver	183.7	0	1	HDL cholesterol;Triglyceride levels;HDL cholesterol levels	
ENSG00000130812	ANGPTL6	liver	30.2	0	1	Thiazide-induced adverse metabolic effects in hypertensive patients;Protein quantitative trait loci	
ENSG00000130173	ANGPTL8	liver	409.8	0	1	HDL cholesterol;HDL cholesterol levels	
ENSG00000132703	APCS	liver	3629.2	0	1	C-reactive protein;Blood protein levels;Neonatal white matter microstructure	
ENSG00000118137	APOA1	liver	19248.5	0	1	Lipid traits;Cholesterol, total;LDL cholesterol;Triglycerides;Hearing function	
ENSG00000158874	APOA2	liver	36012.6	0	1	Carotid intima media thickness (mean)	
ENSG00000110243	APOA5	liver	582.1	0	1	Lipid traits;Blood metabolite levels;Metabolite levels;Triglycerides;Hypertriglyceridemia	
ENSG00000130208	APOC1	liver	16232.1	0	1	Alzheimers disease biomarkers;Alzheimers disease (age of onset);Apolipoprotein Levels;Lipid traits	
ENSG00000234906	APOC2	liver	9641.4	0	1	Carotid intima media thickness (mean);Carotid intima media thickness (maximum);HDL cholesterol levels;Triglyceride levels	
ENSG00000110245	APOC3	liver	27649	1	1	Lipid traits;Refractive error;Platelet count;Triglyceride levels;HDL cholesterol levels	Apolipoprotein C3
ENSG00000267467	APOC4	liver	629.1	0	1	Carotid intima media thickness (mean);Carotid intima media thickness (maximum);HDL cholesterol levels;Apolipoprotein A1 levels	
ENSG00000175336	APOF	liver	416.7	0	1	Blood protein levels;Axial length	
ENSG00000091583	APOH	liver	17965.3	0	1	LDL cholesterol;Low density lipoprotein cholesterol levels;Triglyceride levels;Blood protein levels	
ENSG00000100342	APOL1	liver	220.5	0	1	Blood protein levels;End-stage renal disease;End-stage kidney disease	
ENSG00000204444	APOM	liver	390.7	0	1	Squamous cell lung carcinoma;Lung cancer in ever smokers;Asthma;Asthma (childhood onset);Asthma and major depressive disorder	
ENSG00000111339	ART4	liver	53.3	0	1	Blood protein levels;Hand grip strength	
ENSG00000141505	ASGR1	liver	1092.3	0	1	Low density lipoprotein cholesterol levels;LDL cholesterol levels;Apolipoprotein B levels;Serum alkaline phosphatase levels;Iron status biomarkers (ferritin levels)	
ENSG00000160862	AZGP1	liver	2809.6	0	1	Refractive error;Ticagrelor levels in individuals with acute coronary syndromes treated with ticagrelor;Red blood cell count;Brain morphology (MOSTest);Subcortical volume (MOSTest)	
ENSG00000114200	BCHE	liver	525.1	1	1	Alzheimers disease biomarkers;Blood protein levels;Paclitaxel disposition in epithelial ovarian cancer	Butyrylcholinesterase
ENSG00000169814	BTD	liver	95.9	0	1	Inflammatory skin disease;Metabolite levels;Bipolar disorder;Triglyceride levels;Blood protein levels	
ENSG00000139178	C1RL	liver	141.9	0	1	Blood protein levels;Night sleep phenotypes	
ENSG00000182326	C1S	liver	2915.2	1	1	Red blood cell fatty acid levels;Lung cancer in never smokers;Blood protein levels	Complement C1s
ENSG00000166278	C2	liver	477.9	0	1	Lipid traits;Age-related hearing impairment;Chronic lymphocytic leukemia;Blood metabolite ratios	
ENSG00000125730	C3	liver	4761.3	1	1	Lipid traits;Blood metabolite ratios;Hypospadias;Blood metabolite levels;Glucose homeostasis traits	Complement C3
ENSG00000244731	C4A	liver	336.8	1	1	Breast cancer (early onset);Fractional exhaled nitric oxide (childhood);Hypertension;Systolic blood pressure	Complement C4A (Rodgers blood group)
ENSG00000123838	C4BPA	liver	1918.6	0	1	Venous thromboembolism;Blood protein levels;Refractive error;Spherical equivalent or myopia (age of diagnosis)	
ENSG00000123843	C4BPB	liver	471.3	0	1	Hip circumference;C4b binding protein levels	
ENSG00000106804	C5	liver	433.7	1	1	Age-related hearing impairment;Response to inhaled corticosteroid treatment in asthma (change in FEV1);Blood metabolite levels	Complement C5
ENSG00000039537	C6	liver	665.9	0	1	Chronic obstructive pulmonary disease (moderate to severe);Endometrial cancer;Infant length;Blood metabolite ratios	
ENSG00000157131	C8A	liver	635.7	0	1	Metabolite levels;PR interval;Platelet count;Immune response to measles-mumps-rubella vaccine	
ENSG00000021852	C8B	liver	840	0	1	Menarche (age at onset);Social autistic-like traits;Triglyceride levels;Height	
ENSG00000176919	C8G	liver	564.4	0	1	Blood protein levels;Keratoconus	
ENSG00000113600	C9	liver	1397	0	1	Blood metabolite levels;Amyotrophic lateral sclerosis;White blood cell count	
ENSG00000275152	CCL16	liver	120.3	0	1	Initial pursuit acceleration;Blood protein levels	
ENSG00000170458	CD14	liver	403.4	0	1	Blood protein levels;Refractive error;Serum immune biomarker levels;Schizophrenia	
ENSG00000243649	CFB	liver	2613.2	0	1	Height;Asthma;Chronic hepatitis B infection;Inflammatory bowel disease;Ulcerative colitis	
ENSG00000000971	CFH	liver	1676.3	0	1	IgA nephropathy;Lupus nephritis in systemic lupus erythematosus;Post bronchodilator FEV1/FVC ratio in COPD	
ENSG00000244414	CFHR1	liver	2081.3	0	1	IgA nephropathy;Complement C3 and C4 levels;Advanced age-related macular degeneration;Matrix metalloproteinase-8 levels;Age-related macular degeneration	
ENSG00000080910	CFHR2	liver	1311.8	0	1	Blood protein levels;Alanine aminotransferase (ALT) levels after remission induction therapy in actute lymphoblastic leukemia (ALL);Asthma;Feeling miserable	
ENSG00000116785	CFHR3	liver	505.7	0	1	IgA nephropathy;Complement C3 and C4 levels;Meningococcal disease	
ENSG00000134365	CFHR4	liver	123.9	0	1	Blood protein levels;Serum C3d:C3 ratio (systemic complement activation);Matrix metalloproteinase-8 levels;Phenytoin-induced maculopapular exanthema	
ENSG00000134389	CFHR5	liver	167.5	0	1	Lupus nephritis in systemic lupus erythematosus;Blood protein levels	
ENSG00000205403	CFI	liver	1098.8	0	1	Post bronchodilator FEV1/FVC ratio in COPD;Blood protein levels;Fasting insulin (dietary factor interaction);Homeostasis model assessment of insulin resistance (dietary factor interaction);Advanced age-related macular degeneration	
ENSG00000136457	CHAD	liver	36.2	0	1	Schizophrenia;Lamb consumption;Height;Refractive error;Osteoarthritis (with total hip replacement)	
ENSG00000133048	CHI3L1	liver	447.8	0	1	Blood protein levels in cardiovascular risk;Metabolite levels;Blood protein levels;Clozapine-induced agranulocytosis	
ENSG00000090539	CHRD	liver	130	0	1	Allergic rhinitis;Plateletcrit;Gut microbiota (bacterial taxa, hurdle binary method);Blood protein levels	
ENSG00000120885	CLU	liver	9779.1	0	1	Schizophrenia;Electroencephalogram traits;Lung cancer in ever smokers;Lung adenocarcinoma;Alzheimers disease	
ENSG00000182871	COL18A1	liver	561.9	0	1	HDL cholesterol levels;Apolipoprotein A1 levels;Pursuit maintenance gain;Early-onset Parkinsons disease;Bone mineral density (total hip)	
ENSG00000160963	COL26A1	liver	5.5	0	1	Hemoglobin levels;Lysophosphatidylcholine levels;Intraocular pressure;Diffusing capacity of carbon monoxide	
ENSG00000184374	COLEC10	liver	65.7	0	1	Blood pressure (smoking interaction);Osteoprotegerin levels;Bone mineral density (paediatric, skull)	
ENSG00000118004	COLEC11	liver	143.1	0	1	Intraocular pressure;LDL cholesterol levels;Triglyceride levels;Chronic kidney disease (reduced eGFR or end stage renal disease) in type 1 diabetes;HDL cholesterol levels	
ENSG00000047457	CP	liver	1871.4	0	1	Anger;Blood metabolite levels	
ENSG00000080618	CPB2	liver	1484.1	1	1	Blood protein levels;Thrombin-activatable fibrinolysis inhibitor levels	Carboxypeptidase B2
ENSG00000120054	CPN1	liver	81.6	0	1	Heel bone mineral density;Blood protein levels;General cognitive ability;Creatine kinase levels;Dermatomyositis	
ENSG00000178772	CPN2	liver	218.6	0	1	Triglyceride levels in HIV infection;Blood protein levels	
ENSG00000145708	CRHBP	liver	166.5	0	1	Blood protein levels;Dental caries (decayed, missing and filled tooth surfaces);Chronotype	
ENSG00000132693	CRP	liver	9388.5	0	1	C-reactive protein levels;Acne (severe);Inflammatory biomarkers;Inflammatory biomarkers in Kawasaki disease;Blood protein levels	
ENSG00000081041	CXCL2	liver	509.9	0	1	Metabolite levels;Granulocyte percentage of myeloid white cells;Monocyte percentage of white cells;White blood cell count;Sum neutrophil eosinophil counts	
ENSG00000169242	EFNA1	liver	472.8	0	1	Emotional recognition;Refractive error;Body fat distribution (leg fat ratio);Body fat distribution (trunk fat ratio)	
ENSG00000187097	ENTPD5	liver	263.7	0	1	Refractive error;Blood protein levels;Serum uric acid levels	
ENSG00000130427	EPO	liver	47.2	0	1	LDL cholesterol levels;Hematocrit;Hemoglobin levels;Refractive error	
ENSG00000126218	F10	liver	160	1	1	Chronic lymphocytic leukemia;Attention deficit hyperactivity disorder;Metabolite levels;Fibrinogen;Toenail selenium levels	Coagulation factor X
ENSG00000088926	F11	liver	243.2	1	1	C-reactive protein levels;Breastfeeding duration;Metabolite levels;Inflammatory skin disease	Coagulation factor XI
ENSG00000131187	F12	liver	604.6	1	1	Blood metabolite ratios;Glucose homeostasis traits;Glaucoma (primary open-angle);QRS duration;Bronchopulmonary dysplasia	Coagulation factor XII
ENSG00000143278	F13B	liver	200.2	1	1	Metabolite levels;Lupus nephritis in systemic lupus erythematosus;Multiple myeloma;Low density lipoprotein cholesterol levels;LDL cholesterol levels	Coagulation factor XIII B chain
ENSG00000180210	F2	liver	1217.3	1	1	Chronic obstructive pulmonary disease (moderate to severe);Anger;Response to haloperidol in psychosis;Infant length;Blood metabolite levels	Coagulation factor II, thrombin
ENSG00000057593	F7	liver	160.2	1	1	Pulse pressure (alcohol consumption interaction);Type 2 diabetes;Bipolar disorder (body mass index interaction);Height;Metabolite levels	Coagulation factor VII
ENSG00000101981	F9	liver	704.9	1	1	Amyotrophic lateral sclerosis (sporadic);Schizophrenia;Rheumatoid arthritis;Lung cancer;Time-dependent creatinine clearance change response to tenofovir treatment in HIV infection (time and treatment arm interaction)	Coagulation factor IX
ENSG00000108950	FAM20A	liver	50.2	0	1	Blood protein levels	
ENSG00000160339	FCN2	liver	99.7	0	1	Blood protein levels	
ENSG00000090512	FETUB	liver	234.6	0	1	Activated partial thromboplastin time;Neurological blood protein biomarker levels;Electrocardiogram morphology (amplitude at temporal datapoints)	
ENSG00000171560	FGA	liver	18396.9	1	1	Resting metabolic rate;Autism spectrum disorder or schizophrenia;Alzheimers disease or fasting glucose levels (pleiotropy);Ischemic stroke;Stroke	Fibrinogen alpha chain
ENSG00000171564	FGB	liver	17944.9	1	1	Fibrinogen;Chronic obstructive pulmonary disease-related biomarkers;Fibrinogen levels;Ischemic stroke	Fibrinogen beta chain
ENSG00000105550	FGF21	liver	84.1	0	1	Dietary macronutrient intake;Resting metabolic rate;Relative protein intake;Relative carbohydrate intake;Relative sugar intake	
ENSG00000171557	FGG	liver	16556.3	1	1	Response to antipsychotic therapy (extrapyramidal side effects);Cervical artery dissection;Venous thromboembolism;Triglyceride levels x loop diuretics use interaction	Fibrinogen gamma chain
ENSG00000104760	FGL1	liver	4163.9	0	1	Blood protein levels;Response to bronchodilator in chronic obstructive pulmonary disease (change in FEV1)	
ENSG00000115414	FN1	liver	1725.9	1	1	Cannabis dependence;LDL cholesterol;Response to radiotherapy in cancer (late toxicity);Lung adenocarcinoma;LDL cholesterol levels	Fibronectin 1
ENSG00000134363	FST	liver	68.7	0	1	Colorectal cancer;Acne (severe);Small cell lung carcinoma;Height;Bipolar disorder	
ENSG00000145321	GC	liver	8260.1	0	1	Lipid traits;Medication adherence in chronic diseases;Blood metabolite ratios	
ENSG00000263761	GDF2	liver	18.6	0	1	Refractive error;Hematocrit;Hemoglobin;Systolic blood pressure;Red blood cell count	
ENSG00000112964	GHR	liver	213.3	1	1	Height;Response to taxane treatment (docetaxel);Blood protein levels	Growth hormone receptor
ENSG00000151948	GLT1D1	liver	27.6	0	1	Metabolite levels;HDL cholesterol levels in HIV infection;Schizophrenia (inflammation and infection response interaction)	
ENSG00000182327	GLTPD2	liver	73.8	0	1	Blood protein levels;Sphingomyelin levels	
ENSG00000112293	GPLD1	liver	46.1	0	1	Serum alkaline phosphatase levels	
ENSG00000180875	GREM2	liver	26.3	0	1	Heel bone mineral density;Heel bone mineral density variance;Response to allopurinol in gout (change in serum uric acid levels);Ankle-brachial index;Immune response to smallpox vaccine (IL-6)	
ENSG00000148702	HABP2	liver	437.3	0	1	Peripheral arterial disease (traffic-related air pollution interaction);Eosinophil percentage of white cells;Eosinophil counts;Waist-to-hip ratio adjusted for body mass index	
ENSG00000105697	HAMP	liver	2054.8	0	1	Height;Red cell distribution width;Mean corpuscular hemoglobin concentration;Mean corpuscular hemoglobin	
ENSG00000109758	HGFAC	liver	217.1	0	1	Fibrinogen;Triglyceride levels;Low density lipoprotein cholesterol levels;LDL cholesterol levels	
ENSG00000257017	HP	liver	61113.6	0	1	Blood metabolite ratios;Blood metabolite levels;Amyloid A serum levels;Response to anti-retroviral therapy (ddI/d4T) in HIV-1 infection (Grade 1 peripheral neuropathy)	
ENSG00000261701	HPR	liver	811.9	0	1	Cholesterol, total;LDL cholesterol;Bipolar disorder;Low density lipoprotein cholesterol levels;Triglyceride levels	
ENSG00000110169	HPX	liver	5440.6	0	1	Malaria;Blood protein levels	
ENSG00000113905	HRG	liver	5433.2	0	1	Blood protein levels;Refractive error	
ENSG00000114378	HYAL1	liver	201.6	0	1	Depressive symptom (appetite changes) (binary trait);Depressive symptoms (binary sum-score);Depressive symptoms (sum-score);Sleep duration (short sleep)	
ENSG00000099769	IGFALS	liver	116.7	0	1	Blood protein levels;Insulin-like growth factors;Mean corpuscular hemoglobin	
ENSG00000146678	IGFBP1	liver	1198.4	0	1	Night sleep phenotypes;Pulse pressure;Poor prognosis in Crohns disease	
ENSG00000196083	IL1RAP	liver	225.8	0	1	Blood protein levels;Longitudinal change in brain amyloid plaque burden;Vitiligo;Itch intensity from mosquito bite adjusted by bite size	
ENSG00000197272	IL27	liver	26.7	0	1	Immune response to measles-mumps-rubella vaccine;Lamb consumption;Blood protein levels;Body fat distribution (leg fat ratio);Body fat distribution (arm fat ratio)	
ENSG00000008517	IL32	liver	829.3	0	1	HIV-1 susceptibility;Liver enzyme levels (alanine transaminase);Alanine aminotransferase levels;Aspartate aminotransferase levels	
ENSG00000160712	IL6R	liver	58.3	1	1	Response to anti-retroviral therapy (ddI/d4T) in HIV-1 infection (Grade 2 peripheral neuropathy);Fibrinogen;Rheumatoid arthritis;Cerebrospinal fluid levels of Alzheimers disease-related proteins	Interleukin 6 receptor
ENSG00000175189	INHBC	liver	165	0	1	Asthma;HDL cholesterol levels;Urate levels;Apolipoprotein A1 levels;Hemoglobin levels	
ENSG00000139269	INHBE	liver	148.4	0	1	Platelet count;Itch intensity from mosquito bite adjusted by bite size;Urate levels;HDL cholesterol;Plateletcrit	
ENSG00000055957	ITIH1	liver	1504.9	0	1	Schizophrenia, schizoaffective disorder or bipolar disorder;Glaucoma (primary open-angle);Schizophrenia;Bipolar disorder;Pulse pressure	
ENSG00000151655	ITIH2	liver	2156.1	0	1	Blood protein levels;Ovarian reserve	
ENSG00000162267	ITIH3	liver	792.7	0	1	Schizophrenia;Height;Bipolar disorder;Hemoglobin levels	
ENSG00000055955	ITIH4	liver	1863.4	0	1	Schizophrenia;Bipolar disorder;Risk-taking tendency (4-domain principal component model);Heel bone mineral density	
ENSG00000164344	KLKB1	liver	328.4	1	1	Blood metabolite levels;Serum metabolite levels	Kallikrein B1
ENSG00000113889	KNG1	liver	3195.2	0	1	Blood metabolite levels;Blood protein levels;Small vessel stroke	
ENSG00000129988	LBP	liver	1338.5	0	1	Plasma omega-6 polyunsaturated fatty acid levels (gamma-linolenic acid);Waist circumference adjusted for BMI (adjusted for smoking behaviour);Waist circumference adjusted for BMI (joint analysis main effects and smoking interaction);Apolipoprotein B levels;Blood protein levels	
ENSG00000213398	LCAT	liver	283	0	1	Schizophrenia;HDL cholesterol;Refractive error;HDL cholesterol levels	
ENSG00000164406	LEAP2	liver	532	0	1	Asthma;Blood protein levels	
ENSG00000145826	LECT2	liver	477.9	0	1	Blood protein levels	
ENSG00000166035	LIPC	liver	171	0	1	Lipid traits;Blood metabolite levels;Triglycerides	
ENSG00000198670	LPA	liver	76.7	0	1	Glucose homeostasis traits;Cholesterol, total;Height;LDL cholesterol;Response to statins (LDL cholesterol change)	
ENSG00000171236	LRG1	liver	944.2	0	1	Refractive error;Fibrinogen levels;Sjögrens syndrome;Fibrinogen	
ENSG00000127241	MASP1	liver	183.4	0	1	Amyotrophic lateral sclerosis (sporadic);Blood protein levels;Impulsivity (attentional);Type 2 diabetes	
ENSG00000009724	MASP2	liver	476.5	0	1	Beard thickness;Eosinophil percentage of white cells;Male-pattern baldness;Body mass index;Appendicular lean mass	
ENSG00000165471	MBL2	liver	280.9	0	1	Metabolite levels;Bone properties (heel);Heel bone mineral density	
ENSG00000105976	MET	liver	42.9	1	1	Metabolite levels;Triglycerides;Electroencephalogram traits;Opioid sensitivity;Borderline personality disorder	MET proto-oncogene, receptor tyrosine kinase
ENSG00000183971	NPW	liver	10.6	0	1	Bone mineral density (paediatric, upper limb);Bone mineral density (paediatric, skull)	
ENSG00000184232	OAF	liver	396.6	0	1	Systolic blood pressure;Urinary albumin-to-creatinine ratio;Blood protein levels;Retinal detachment or retinal break	
ENSG00000138315	OIT3	liver	110.8	0	1	Refractive error;Coronary artery disease;Low density lipoprotein cholesterol levels;Total cholesterol levels	
ENSG00000229314	ORM1	liver	42973.6	0	1	Thrombin generation potential phenotypes;End-stage coagulation;Tourette syndrome	
ENSG00000228278	ORM2	liver	8873.2	0	1	Blood protein levels	
ENSG00000169174	PCSK9	liver	48.7	1	1	Metabolite levels;Cholesterol, total;LDL cholesterol;Apolipoprotein B levels	Proprotein convertase subtilisin/kexin type 9
ENSG00000161031	PGLYRP2	liver	258.8	0	1	Blood protein levels	
ENSG00000138308	PLA2G12B	liver	71	0	1	Triglyceride levels;Refractive error;HDL cholesterol levels;Systolic blood pressure	
ENSG00000122194	PLG	liver	2666.4	1	1	Conduct disorder (symptom count);Acne (severe);Triglyceride levels;Blood protein levels	Plasminogen
ENSG00000005421	PON1	liver	531.8	0	1	Blood protein levels;HDL cholesterol levels;Refractive error;Blood protein levels in cardiovascular risk;Glucagon levels in response to oral glucose tolerance test (fasting)	
ENSG00000115718	PROC	liver	598.5	1	1	Amyotrophic lateral sclerosis (sporadic);Protein C levels;Venous thromboembolism	Protein C, inactivator of coagulation factors Va and VIIIa
ENSG00000126231	PROZ	liver	109.2	0	1	Bipolar disorder;Food allergy (parent-of-origin effect);Factor VII;Reticulocyte fraction of red cells	
ENSG00000151006	PRSS53	liver	9.9	0	1	Scalp hair shape;Psoriasis;Psoriasis vulgaris;Psoriatic arthritis	
ENSG00000126838	PZP	liver	81.6	0	1	Low density lipoprotein cholesterol levels;Refractive error;Blood protein levels;Spherical equivalent or myopia (age of diagnosis);Myopia	
ENSG00000106538	RARRES2	liver	1994.6	0	1	Suicide attempts in depression or bipolar disorder;Circulating chemerin levels;Chemerin levels	
ENSG00000138207	RBP4	liver	11920.3	0	1	Optic disc area;Retinol levels;Blood protein levels	
ENSG00000258818	RNASE4	liver	478.8	0	1	Paclitaxel disposition in epithelial ovarian cancer;Blood protein levels	
ENSG00000173432	SAA1	liver	48144.3	0	1	Amyloid A serum levels;Blood protein levels;Rosacea symptom severity	
ENSG00000134339	SAA2	liver	36265.6	0	1	Rosacea symptom severity	
ENSG00000148965	SAA4	liver	1943.5	0	1	Blood protein levels;Rosacea symptom severity	
ENSG00000115884	SDC1	liver	484.7	0	1	Amyotrophic lateral sclerosis (sporadic);Seasonality;Triglyceride levels;LDL cholesterol levels;HDL cholesterol levels	
ENSG00000124145	SDC4	liver	410.9	0	1	Psoriasis;Breast size;Malaria	
ENSG00000197249	SERPINA1	liver	34022.4	0	1	Social communication problems;Height;Low density lipoprotein cholesterol levels;Alcohol consumption (drinks per week);Blood protein levels	
ENSG00000140093	SERPINA10	liver	346.9	0	1	Blood protein levels;Post bronchodilator FEV1;Waist-to-hip ratio adjusted for body mass index;Emphysema imaging phenotypes	
ENSG00000186910	SERPINA11	liver	490.6	0	1	Blood protein levels;Antineutrophil cytoplasmic antibody-associated vasculitis	
ENSG00000100665	SERPINA4	liver	550	0	1	Blood protein levels	
ENSG00000188488	SERPINA5	liver	785.6	0	1	Serum albumin levels;Serum total protein level;Blood protein levels	
ENSG00000170099	SERPINA6	liver	776.6	0	1	LDL cholesterol levels;Apolipoprotein B levels;Manganese levels;Breast size;Alanine aminotransferase levels	
ENSG00000123561	SERPINA7	liver	282.2	0	1	Metabolite levels	
ENSG00000117601	SERPINC1	liver	5056.6	1	1	Heel bone mineral density;Experiencing mood swings	Serpin family C member 1
ENSG00000099937	SERPIND1	liver	1253.1	1	0		Serpin family D member 1
ENSG00000167711	SERPINF2	liver	1578.5	0	1	Blood protein levels;Serum albumin levels;Calcium levels	
ENSG00000149131	SERPING1	liver	2622.4	0	1	Schizophrenia;Autism spectrum disorder or schizophrenia;Neuroticism;Blood protein levels;Obesity-related traits	
ENSG00000129214	SHBG	liver	63.4	1	1	Sex hormone-binding globulin levels	Sex hormone binding globulin
ENSG00000198732	SMOC1	liver	67.9	0	1	Bone mineral density;Blood protein levels	
ENSG00000072080	SPP2	liver	519.1	0	1	Hair greying;Cognitive decline (age-related);Osteoporosis-related phenotypes;Triglyceride levels	
ENSG00000003436	TFPI	liver	272.3	1	1	Lung adenocarcinoma;Serum immune biomarker levels;Apolipoprotein A1 levels;Heart rate response to recovery post exercise (40 sec);Heart rate response to recovery post exercise (30 sec)	Tissue factor pathway inhibitor
ENSG00000090534	THPO	liver	35.4	0	1	Plateletcrit;Platelet count	
ENSG00000120659	TNFSF11	liver	5.2	1	1	C-reactive protein levels;Bone mineral density;Bone mineral density (paediatric, upper limb)	TNF superfamily member 11
ENSG00000182704	TSKU	liver	237.3	0	1	Adult body size;Factor VII activity;Asthma	
ENSG00000145777	TSLP	liver	11.5	0	1	Eosinophilic esophagitis;Self-reported allergy;Eosinophilic granulomatosis with polyangiitis;Asthma	
ENSG00000109072	VTN	liver	6039.5	0	1	Osteoprotegerin levels;Low density lipoprotein cholesterol levels;Heel bone mineral density;Blood protein levels	
