Gene	Gene.name	Tissue	nTPM	fda	gwcat	gwasTraits	fdaGeneDesc
ENSG00000203747	FCGR3A	spleen	306.8	1	1	Functional impairment in major depressive disorder, bipolar disorder and schizophrenia;Ulcerative colitis;Inflammatory bowel disease;Basophil count	Fc fragment of IgG receptor IIIa
ENSG00000162747	FCGR3B	spleen	82	1	1	Hemoglobin levels;Ulcerative colitis;Inflammatory bowel disease;Basophil percentage of white cells;Basophil percentage of granulocytes	Fc fragment of IgG receptor IIIb
ENSG00000211893	IGHG2	spleen	4319.4	1	1	IgG levels;Composite immunoglobulin trait (IgA/IgG)	Immunoglobulin heavy constant gamma 2 (G2m marker)
ENSG00000211892	IGHG4	spleen	831.6	1	0		Immunoglobulin heavy constant gamma 4 (G4m marker)
ENSG00000232810	TNF	spleen	6.5	1	1	C-reactive protein levels;Vitiligo;Attention deficit hyperactivity disorder;Rheumatoid arthritis	Tumor necrosis factor
ENSG00000102524	TNFSF13B	spleen	15.9	1	1	Metabolite levels;HDL cholesterol levels;Apolipoprotein A1 levels;White blood cell count;Plateletcrit	TNF superfamily member 13b
